<?xml version="1.0" encoding="UTF-8"?>
<QuanLySach xmlns:xsi="http://www.w3.org/2001/XMLSchema-instance"
 xsi:noNamespaceSchemaLocation="file:/D:/Projects/BaiTapXML/chuong4-bai3/QuanLySach.xsd">
    <LinhVuc>
        <TenLinhVuc>TenLinhVuc0</TenLinhVuc>
        <Sach>
            <MaSach>AA0000</MaSach>
            <TuaDe>TuaDe0</TuaDe>
            <TacGia>
                <MaTacGia>MaTacGia0</MaTacGia>
                <TenTacGia>TenTacGia0</TenTacGia>
                <DiaChiEmail>00@00.ww</DiaChiEmail>
                <SDT>00.0</SDT>
            </TacGia>
            <TacGia>
                <MaTacGia>MaTacGia1</MaTacGia>
                <TenTacGia>TenTacGia1</TenTacGia>
                <DiaChiEmail>00@00.ww</DiaChiEmail>
                <SDT>00.0</SDT>
            </TacGia>
        </Sach>
    </LinhVuc>
    <LinhVuc>
        <TenLinhVuc>TenLinhVuc1</TenLinhVuc>
        <Sach>
            <MaSach>AA0000</MaSach>
            <TuaDe>TuaDe1</TuaDe>
            <TacGia>
                <MaTacGia>MaTacGia2</MaTacGia>
                <TenTacGia>TenTacGia2</TenTacGia>
                <DiaChiEmail>00@00.ww</DiaChiEmail>
                <SDT>00.0</SDT>
            </TacGia>
            <TacGia>
                <MaTacGia>MaTacGia3</MaTacGia>
                <TenTacGia>TenTacGia3</TenTacGia>
                <DiaChiEmail>00@00.ww</DiaChiEmail>
                <SDT>00.0</SDT>
            </TacGia>
        </Sach>
    </LinhVuc>
</QuanLySach>
